Ticket No,Created Date,Created Time,Assigned To,Resolved Date,Resolved Time,Landing Folder,Disposition Folder Level 1,Disposition Folder Level 2,Phone,Email,Ticket All Remarks,Program Name,Issue 2 - NPS,NPS Rating,Status,Sub Status
75650006353,2025-08-09,09:06:26,Amit Patel,,,Counselling Team - NPS,Counselling Team - NPS,Placement (NPS),9028959334,learner113@example.com,"Career guidance sessions focus only on technical skills. No discussion about salary negotiation, Ola culture fit, or work-life balance considerations. || Resolution: Introduced holistic career coaching covering all professional aspects",Academy,Mentor Support Related Concerns (NPS),4,Complete,Solved
75744851196,2025-08-27,13:41:03,Mike Chen,2025-09-04,16:41:12,Counselling Team - NPS,Counselling Team - NPS,Program & Classroom (NPS),9801601713,learner114@example.com,"System Design course only teaches monolithic patterns. Microservices, event-driven architecture, and serverless barely mentioned. Need cloud-native design patterns. || Resolution: Expanding curriculum with 40 hours of distributed systems content",DevOps,Unhappy With Course Curriculum (NPS),1,Complete,Solved
75588751681,2025-08-03,09:53:25,Carlos Martinez,,,Counselling Team - NPS,Counselling Team - NPS,Placement (NPS),7800202342,learner115@example.com,Previous employment gap of 3 years due to child care responsibilities creates placement barrier. Returning mothers face additional discrimination. || Resolution: Partnered with diversity-focused companies supporting career restart initiatives,DSML,Not eligible for placements (NPS),3,Pending,Awaiting Action - Scaler
75941394238,2025-08-22,16:17:12,Mike Chen,2025-09-02,17:33:31,Counselling Team - NPS,Counselling Team - NPS,Program & Classroom (NPS),8420277403,learner116@example.com,Evening Academy Jul25 Intermediate starts at 7 PM when dinner time with family. Work-life balance getting affected due to late learning schedule. || Resolution: Introduced early evening slots (6-8 PM) based on demand,AIML,Unhappy With The Class Timings (NPS),9,Complete,Solved
75588436227,2025-09-17,18:54:40,Jessica Kim,2025-09-22,18:43:48,Counselling Team - NPS,Counselling Team - NPS,Others (NPS),8836971472,learner117@example.com,Holiday classes scheduled during Diwali week without considering festival commitments. Attendance drops to 30% affecting Academy Jul25 Beginner momentum. || Resolution: Rescheduled holiday periods and created festival-friendly calendar,AIML,Time Management Related Concerns (NPS),1,Complete,Solved
75407333788,2025-08-07,13:24:15,Carlos Martinez,2025-08-10,16:20:59,Counselling Team - NPS,Counselling Team - NPS,Placement (NPS),8146731886,learner118@example.com,Multiple interview rounds cleared but final selection goes to internal referrals. External candidates seem disadvantaged despite equal performance. || Resolution: Expanded alumni network for referral opportunities and insider advocacy,AIML,Applied for jobs but no satisfactory outcome (NPS),1,Complete,Solved
75899714064,2025-08-01,13:10:25,Rohit Gupta,,,Counselling Team - NPS,Counselling Team - NPS,Placement (NPS),8335640103,learner119@example.com,"Considering freelancing transition after 8 years in corporate. Need guidance on building client base, pricing projects, and managing business aspects. || Resolution: Introduced to successful freelancer mentor and provided business setup guidance",Academy,Looking For Career Guidance (NPS),2,Complete,Solved
75888529624,2025-08-15,20:38:23,Jessica Kim,,,Counselling Team - NPS,Counselling Team - NPS,Program & Classroom (NPS),9358944233,learner120@example.com,Weekend AIML Aug25 timing (10 AM - 2 PM) conflicts with family time. Children's activities and household responsibilities suffer due to class schedule. || Resolution: Created flexible weekend options with shorter session formats,AIML,Unhappy With The Class Timings (NPS),7,Pending,Awaiting Action - Learner
75520483278,2025-09-20,09:53:35,Rohit Gupta,2025-09-28,17:45:23,Counselling Team - NPS,Counselling Team - NPS,Others (NPS),7868256753,learner121@example.com,Multiple TAs provide conflicting solutions for same problem. Creates confusion about best practices and correct approach for implementation. || Resolution: Implemented TA training program and standardized solution guidelines,Academy,TA Support Related Concerns (NPS),2,Complete,Solved
75459738492,2025-08-29,16:08:32,Jessica Kim,2025-09-02,18:31:05,Counselling Team - NPS,Counselling Team - NPS,Placement (NPS),8961934510,learner122@example.com,Placement team requires 2+ years experience but won't help freshers. Catch-22 situation where experience needed for placement but placement needed for experience. || Resolution: Launched fresh graduate placement track with entry-level focused companies,DSML,Not eligible for placements (NPS),1,Complete,Solved
75633969748,2025-09-21,18:04:02,Jessica Kim,2025-09-22,15:16:52,Counselling Team - NPS,Counselling Team - NPS,Placement (NPS),8479740208,learner123@example.com,Placement eligibility criteria require 70%+ in graduation but scored 68% due to family financial crisis during college. Seems unfair exclusion. || Resolution: Reviewed eligibility criteria and created exception process for genuine hardship cases,Academy,Not eligible for placements (NPS),4,Complete,Solved
75802074351,2025-08-03,15:28:55,Jessica Kim,2025-08-06,11:49:41,Counselling Team - NPS,Counselling Team - NPS,Program & Classroom (NPS),8613385303,learner124@example.com,Weekend DSML Aug25 timing (10 AM - 2 PM) conflicts with family time. Children's activities and household responsibilities suffer due to class schedule. || Resolution: Created flexible weekend options with shorter session formats,DSML,Unhappy With The Class Timings (NPS),3,Complete,Solved
75720364823,2025-09-04,16:43:46,Rohit Gupta,2025-09-07,12:53:00,Counselling Team - NPS,Counselling Team - NPS,Program & Classroom (NPS),8821616017,learner125@example.com,"System Design course only teaches monolithic patterns. Microservices, event-driven architecture, and serverless barely mentioned. Need cloud-native design patterns. || Resolution: Expanding curriculum with 40 hours of distributed systems content",Academy,Unhappy With Course Curriculum (NPS),3,Complete,Solved
75416799547,2025-08-23,12:13:04,Mike Chen,2025-08-27,10:02:51,Counselling Team - NPS,Counselling Team - NPS,Placement (NPS),9550970716,learner126@example.com,Contract/freelance offers available but seeking permanent positions with benefits and job security. Market seems tilted toward gig work. || Resolution: Targeted Microsoft outreach focusing on full-time opportunity pipeline,DSML,Applied for jobs but no satisfactory outcome (NPS),1,Complete,Solved
75460606325,2025-08-04,11:32:18,David Wilson,2025-08-05,15:28:14,Counselling Team - NPS,Counselling Team - NPS,Program & Classroom (NPS),9474375067,learner127@example.com,"Teaching pace in Data Structures class is inconsistent. Some days covers 3 algorithms, other days struggles with basic concepts. No structured lesson planning visible. || Resolution: Introduced standardized lesson plans with time allocations",AIML,Instructor Related Feedback (NPS),5,Complete,Solved
75858703133,2025-09-12,17:31:03,Amit Patel,2025-09-19,13:17:03,Counselling Team - NPS,Counselling Team - NPS,Placement (NPS),9763021449,learner128@example.com,Want to pursue management track vs staying technical. Currently team lead but unsure about MBA requirements and career progression options. || Resolution: Arranged sessions with both technical architects and engineering managers,AIML,Looking For Career Guidance (NPS),8,Complete,Solved
75658737619,2025-08-27,12:19:54,Priya Sharma,2025-09-01,15:11:48,Counselling Team - NPS,Counselling Team - NPS,Others (NPS),8988677919,learner129@example.com,Audio-video sync issues during recorded playback. Instructor Ravi Sharma's voice doesn't match lip movement by 2-3 seconds. Distracting during learning. || Resolution: Fixed encoding pipeline and re-processed affected recordings,DSML,Poor Class video quality (NPS),6,Complete,Solved
75882954920,2025-08-09,14:05:34,David Wilson,2025-08-14,12:21:41,Counselling Team - NPS,Counselling Team - NPS,Program & Classroom (NPS),7221348142,learner130@example.com,Instructor Amit Gupta Amit Gupta doesn't prepare well for classes. Frequently says 'I'll get back to you' for basic SQL queries. Students lose confidence in course quality. || Resolution: Implemented mandatory instructor preparation reviews,Academy,Instructor Related Feedback (NPS),5,Complete,Solved
75757517705,2025-08-05,13:58:00,David Wilson,2025-08-15,17:13:30,Counselling Team - NPS,Counselling Team - NPS,Placement (NPS),7816145550,learner131@example.com,Transitioning from mechanical engineering to software development. Resume lacks relevant projects and recruiters doubt career change authenticity. || Resolution: Created transition portfolio with domain-crossover projects,AIML,Frequent Resume Rejection (NPS),1,Complete,Solved
75703932500,2025-08-26,15:29:34,Amit Patel,,,Counselling Team - NPS,Counselling Team - NPS,Program & Classroom (NPS),8324663629,learner132@example.com,Weekend AIML Aug25 timing (10 AM - 2 PM) conflicts with family time. Children's activities and household responsibilities suffer due to class schedule. || Resolution: Created flexible weekend options with shorter session formats,DevOps,Unhappy With The Class Timings (NPS),6,Pending,In Progress
75743847870,2025-08-07,12:23:20,Jessica Kim,,,Counselling Team - NPS,Counselling Team - NPS,Placement (NPS),7196346343,learner133@example.com,Career gap of 18 months for personal reasons creating red flags. Recruiters question commitment and skill currency despite recent course completion. || Resolution: Developed gap explanation strategy and skill demonstration projects,DSML,Frequent Resume Rejection (NPS),5,Pending,In Progress
75716960306,2025-09-05,11:12:21,David Wilson,,,Counselling Team - NPS,Counselling Team - NPS,Placement (NPS),8631399401,learner134@example.com,Previous employment gap of 3 years due to child care responsibilities creates placement barrier. Returning mothers face additional discrimination. || Resolution: Partnered with diversity-focused companies supporting career restart initiatives,DSML,Not eligible for placements (NPS),2,Pending,In Progress
75581747678,2025-09-13,11:46:34,Carlos Martinez,2025-09-21,16:29:10,Counselling Team - NPS,Counselling Team - NPS,Placement (NPS),7790479137,learner135@example.com,Previous employment gap of 3 years due to child care responsibilities creates placement barrier. Returning mothers face additional discrimination. || Resolution: Partnered with diversity-focused companies supporting career restart initiatives,DevOps,Not eligible for placements (NPS),1,Complete,Solved
75472980019,2025-09-12,20:09:00,David Wilson,2025-09-13,15:08:53,Counselling Team - NPS,Counselling Team - NPS,Placement (NPS),7790479137,learner136@example.com,Appearing for interviews but consistently failing in system design rounds. Completed course but still struggle with scalability and architecture questions. || Resolution: Arranged advanced system design workshops with industry architects,AIML,Applied for jobs but no satisfactory outcome (NPS),6,Complete,Solved
75416891857,2025-09-12,09:34:35,Jessica Kim,,,Counselling Team - NPS,Counselling Team - NPS,Tech (NPS),7050899550,learner137@example.com,Language barrier with some TAs makes doubt sessions ineffective. Accent and communication style difficult to understand during technical explanations. || Resolution: Provided communication training and paired TAs with complementary strengths,DSML,TA Support Related Concerns (NPS),7,Pending,Awaiting Action - Learner
75592486308,2025-09-02,10:58:06,Rohit Gupta,,,Counselling Team - NPS,Counselling Team - NPS,Program & Classroom (NPS),7639509845,learner138@example.com,Mike Wilson uses outdated examples in Machine Learning classes. Still teaching scikit-learn 0.22 syntax when industry uses 1.3+. Students struggle with modern ML libraries. || Resolution: Updated all code examples to latest library versions,DSML,Instructor Related Feedback (NPS),4,Pending,In Progress
75642512383,2025-08-23,13:43:52,Mike Chen,2025-08-30,10:23:25,Counselling Team - NPS,Counselling Team - NPS,Placement (NPS),9807773530,learner139@example.com,"Mentor doesn't understand non-tech background. As commerce graduate transitioning to data science, need someone who understands career pivot challenges. || Resolution: Assigned mentor with similar career transition background",DSML,Mentor Support Related Concerns (NPS),7,Complete,Solved
75936718857,2025-08-25,15:41:50,Amit Patel,2025-08-26,09:44:10,Counselling Team - NPS,Counselling Team - NPS,Program & Classroom (NPS),9430335702,learner140@example.com,No downloadable notes provided for complex topics. Difficult to review mathematical formulas and algorithms without written reference material. || Resolution: Created comprehensive downloadable study guides for all modules,Academy,Lecture Notes Related (NPS),7,Complete,Solved
75691086098,2025-08-14,09:59:04,Lisa Rodriguez,,,Counselling Team - NPS,Counselling Team - NPS,Program & Classroom (NPS),9332299091,learner141@example.com,No downloadable notes provided for complex topics. Difficult to review mathematical formulas and algorithms without written reference material. || Resolution: Created comprehensive downloadable study guides for all modules,DSML,Lecture Notes Related (NPS),1,Pending,In Progress
75574429624,2025-08-14,18:15:36,Jessica Kim,2025-08-26,15:59:04,Counselling Team - NPS,Counselling Team - NPS,Placement (NPS),9907843037,learner142@example.com,Placement eligibility criteria require 70%+ in graduation but scored 68% due to family financial crisis during college. Seems unfair exclusion. || Resolution: Reviewed eligibility criteria and created exception process for genuine hardship cases,DevOps,Not eligible for placements (NPS),1,Complete,Solved
75937722224,2025-08-09,20:22:03,Mike Chen,,,Counselling Team - NPS,Counselling Team - NPS,Placement (NPS),8877279755,learner143@example.com,Multiple interview rounds cleared but final selection goes to internal referrals. External candidates seem disadvantaged despite equal performance. || Resolution: Expanded alumni network for referral opportunities and insider advocacy,Academy,Applied for jobs but no satisfactory outcome (NPS),1,Pending,In Progress
75644961731,2025-09-08,14:35:24,Jessica Kim,2025-09-14,09:40:17,Counselling Team - NPS,Counselling Team - NPS,Others (NPS),7797737957,learner144@example.com,Mentor Amit Patel provides only generic advice like 'practice more coding'. Asked specific questions about Google interview process but got template responses. || Resolution: Connected with mentor who recently joined FAANG PayTM,DSML,Mentor Support Related Concerns (NPS),2,Complete,Solved
75488087644,2025-08-19,13:09:24,Priya Sharma,,,Counselling Team - NPS,Counselling Team - NPS,Program & Classroom (NPS),8673413661,learner145@example.com,Audio-video sync issues during recorded playback. Instructor Sarah Johnson's voice doesn't match lip movement by 2-3 seconds. Distracting during learning. || Resolution: Fixed encoding pipeline and re-processed affected recordings,Academy,Poor Class video quality (NPS),3,Pending,In Progress
75862760731,2025-08-20,16:35:35,Rohit Gupta,2025-08-25,10:08:05,Counselling Team - NPS,Counselling Team - NPS,Placement (NPS),8752536389,learner146@example.com,Want to pursue management track vs staying technical. Currently team lead but unsure about MBA requirements and career progression options. || Resolution: Arranged sessions with both technical architects and engineering managers,AIML,Looking For Career Guidance (NPS),4,Complete,Solved
75816396603,2025-08-06,10:46:57,Rohit Gupta,2025-08-12,15:00:18,Counselling Team - NPS,Counselling Team - NPS,Program & Classroom (NPS),8042571199,learner147@example.com,DSML curriculum still uses Pandas 1.3 when industry standard is 2.1+. Modern data manipulation techniques like polars not covered. Outdated for current job requirements. || Resolution: Curriculum team updating all library versions and adding modern tools,DSML,Unhappy With Course Curriculum (NPS),3,Complete,Solved
75696311802,2025-08-18,15:19:30,Mike Chen,2025-08-26,11:04:10,Counselling Team - NPS,Counselling Team - NPS,Placement (NPS),8551019709,learner148@example.com,Placement team requires 2+ years experience but won't help freshers. Catch-22 situation where experience needed for placement but placement needed for experience. || Resolution: Launched fresh graduate placement track with entry-level focused companies,DSML,Not eligible for placements (NPS),4,Complete,Solved
75807903732,2025-08-13,14:28:21,Jessica Kim,2025-08-16,13:00:25,Counselling Team - NPS,Counselling Team - NPS,Placement (NPS),9796181989,learner149@example.com,Applied to 43 DevOps positions but recruiters say experience looks theoretical. Need real production environment projects to demonstrate practical skills. || Resolution: Arranged internship-style capstone project with live infrastructure,DevOps,Frequent Resume Rejection (NPS),5,Complete,Solved
75927215082,2025-09-14,18:50:15,Amit Patel,2025-09-20,11:25:20,Counselling Team - NPS,Counselling Team - NPS,Placement (NPS),8615145225,learner150@example.com,Placement team requires 2+ years experience but won't help freshers. Catch-22 situation where experience needed for placement but placement needed for experience. || Resolution: Launched fresh graduate placement track with entry-level focused companies,DevOps,Not eligible for placements (NPS),4,Complete,Awaiting Action - Scaler
75895663087,2025-08-13,20:13:28,Lisa Rodriguez,2025-08-22,11:43:49,Counselling Team - NPS,Counselling Team - NPS,Placement (NPS),9975704877,learner151@example.com,Transitioning from mechanical engineering to software development. Resume lacks relevant projects and recruiters doubt career change authenticity. || Resolution: Created transition portfolio with domain-crossover projects,Academy,Frequent Resume Rejection (NPS),5,Complete,Solved
75479419456,2025-08-20,16:38:30,Sneha Reddy,2025-08-31,11:45:27,Counselling Team - NPS,Counselling Team - NPS,Program & Classroom (NPS),8721444792,learner152@example.com,"Full Stack development track doesn't cover modern React patterns like hooks, context, or Next.js. Still teaching class components from React 16. || Resolution: Complete overhaul of React curriculum to cover React 18 features",DSML,Unhappy With Course Curriculum (NPS),7,Complete,Solved
75517434526,2025-09-14,12:42:42,Amit Patel,,,Counselling Team - NPS,Counselling Team - NPS,Placement (NPS),7714418371,learner153@example.com,Contract/freelance offers available but seeking permanent positions with benefits and job security. Market seems tilted toward gig work. || Resolution: Targeted Infosys outreach focusing on full-time opportunity pipeline,Academy,Applied for jobs but no satisfactory outcome (NPS),5,Pending,In Progress
75677818215,2025-09-11,12:32:47,Rohit Gupta,2025-09-17,15:06:00,Counselling Team - NPS,Counselling Team - NPS,Program & Classroom (NPS),9396563469,learner154@example.com,Screen sharing resolution too low during coding sessions. Can't read code examples on mobile device. Zoom compression makes text blurry. || Resolution: Upgraded streaming quality to 1080p and optimized for mobile viewing,Academy,Poor Class video quality (NPS),2,Complete,Solved
75770405910,2025-08-30,09:30:06,,,,Counselling Team - NPS,Counselling Team - NPS,Placement (NPS),8786600854,learner155@example.com,Previous employment gap of 3 years due to child care responsibilities creates placement barrier. Returning mothers face additional discrimination. || Resolution: Partnered with diversity-focused companies supporting career restart initiatives,AIML,Not eligible for placements (NPS),7,Pending,In Progress
75504821934,2025-08-22,16:46:44,Carlos Martinez,2025-08-26,17:30:22,Counselling Team - NPS,Counselling Team - NPS,Program & Classroom (NPS),8369705770,learner156@example.com,"Academy Python track missing async programming, type hints, and dataclasses. These are mandatory for senior roles at Google, Microsoft, Meta. Current content feels like 2020 curriculum. || Resolution: Added advanced Python module covering modern language features",DSML,Unhappy With Course Curriculum (NPS),8,Complete,Solved
75661899532,2025-08-08,17:11:35,Priya Sharma,2025-08-14,10:43:51,Counselling Team - NPS,Counselling Team - NPS,Program & Classroom (NPS),8421589752,learner157@example.com,"DevOps curriculum missing GitOps, service mesh, and observability tools. Only covers basic Docker and Jenkins. Modern DevOps uses ArgoCD, Istio, Prometheus. || Resolution: Updated DevOps track with cloud-native toolchain coverage",AIML,Unhappy With Course Curriculum (NPS),4,Complete,Solved
75882727494,2025-09-10,18:27:24,Sarah Johnson,2025-09-21,15:25:01,Counselling Team - NPS,Counselling Team - NPS,Placement (NPS),7922542252,learner158@example.com,Contract/freelance offers available but seeking permanent positions with benefits and job security. Market seems tilted toward gig work. || Resolution: Targeted Microsoft outreach focusing on full-time opportunity pipeline,AIML,Applied for jobs but no satisfactory outcome (NPS),5,Complete,Solved
75611606895,2025-09-21,16:07:16,Carlos Martinez,,,Counselling Team - NPS,Counselling Team - NPS,Tech (NPS),9266518721,learner159@example.com,"Career guidance sessions focus only on technical skills. No discussion about salary negotiation, PayTM culture fit, or work-life balance considerations. || Resolution: Introduced holistic career coaching covering all professional aspects",DevOps,Mentor Support Related Concerns (NPS),5,Pending,Awaiting Action - Scaler
75719378952,2025-08-26,18:37:05,Priya Sharma,2025-09-01,14:54:29,Counselling Team - NPS,Counselling Team - NPS,Program & Classroom (NPS),8345122542,learner160@example.com,Audio-video sync issues during recorded playback. Instructor Nina Patel's voice doesn't match lip movement by 2-3 seconds. Distracting during learning. || Resolution: Fixed encoding pipeline and re-processed affected recordings,AIML,Poor Class video quality (NPS),4,Complete,Solved
75812005439,2025-08-24,15:11:31,Rohit Gupta,2025-09-02,15:26:38,Counselling Team - NPS,Counselling Team - NPS,Program & Classroom (NPS),9978271740,learner161@example.com,"Machine Learning module lacks MLOps content. No coverage of model deployment, monitoring, or A/B testing. Industry expects end-to-end ML pipeline knowledge. || Resolution: Adding MLOps specialization track with hands-on deployment projects",AIML,Unhappy With Course Curriculum (NPS),7,Complete,Solved
75410290140,2025-08-19,16:08:12,Jessica Kim,2025-08-25,16:39:03,Counselling Team - NPS,Counselling Team - NPS,Program & Classroom (NPS),9411976659,learner162@example.com,Screen sharing resolution too low during coding sessions. Can't read code examples on mobile device. Zoom compression makes text blurry. || Resolution: Upgraded streaming quality to 1080p and optimized for mobile viewing,DevOps,Poor Class video quality (NPS),3,Complete,Solved
75636791759,2025-08-27,13:02:17,David Wilson,2025-09-04,16:10:05,Counselling Team - NPS,Counselling Team - NPS,Placement (NPS),9309011435,learner163@example.com,Geographic restrictions limiting opportunities. Family commitments require staying in Tier-2 city but most opportunities in Bangalore/Hyderabad. || Resolution: Focused on remote opportunities and companies with distributed teams,Academy,Applied for jobs but no satisfactory outcome (NPS),7,Complete,Solved
75522628457,2025-09-19,13:49:34,,,,Counselling Team - NPS,Counselling Team - NPS,Placement (NPS),9328058564,learner164@example.com,Resume highlighting DSML completion not attracting ML Engineer positions. Only getting data entry or analyst roles below skill level and salary expectations. || Resolution: Added ML portfolio projects and technical blog writing to demonstrate expertise,Academy,Frequent Resume Rejection (NPS),1,Pending,In Progress
75882896428,2025-08-28,13:22:55,Mike Chen,2025-09-08,12:19:55,Counselling Team - NPS,Counselling Team - NPS,Program & Classroom (NPS),8885790857,learner165@example.com,No downloadable notes provided for complex topics. Difficult to review mathematical formulas and algorithms without written reference material. || Resolution: Created comprehensive downloadable study guides for all modules,Academy,Lecture Notes Related (NPS),7,Complete,Solved
75549502403,2025-09-07,12:52:13,Sarah Johnson,2025-09-19,18:40:27,Counselling Team - NPS,Counselling Team - NPS,Program & Classroom (NPS),9448450685,learner166@example.com,No downloadable notes provided for complex topics. Difficult to review mathematical formulas and algorithms without written reference material. || Resolution: Created comprehensive downloadable study guides for all modules,AIML,Lecture Notes Related (NPS),2,Complete,Solved
75687057426,2025-08-21,17:57:43,,,,Counselling Team - NPS,Counselling Team - NPS,Placement (NPS),7582349911,learner167@example.com,"Considering freelancing transition after 8 years in corporate. Need guidance on building client base, pricing projects, and managing business aspects. || Resolution: Introduced to successful freelancer mentor and provided business setup guidance",DevOps,Looking For Career Guidance (NPS),3,Pending,Awaiting Action - Learner
75821659217,2025-08-09,16:09:36,Lisa Rodriguez,2025-08-12,12:09:45,Counselling Team - NPS,Counselling Team - NPS,Placement (NPS),9696435541,learner168@example.com,Told course would take 6 months but curriculum actually requires 10+ months for completion. Time commitment significantly underestimated. || Resolution: Updated course duration estimates and provided realistic timeline planning,DevOps,False Promise By Sales Team (NPS),1,Complete,Solved
